{
  "platform": "antigravity",
  "arm": "baseline",
  "timestamp": "YYYYMMDDTHHMMSSZ",
  "fixture": "bench/fixtures/.memory (standard)",
  "antigravity_version": "",
  "gemini_model": "gemini-3-pro",
  "notes": "",
  "results": [
    {
      "prompt_id": "PROMPT_01_FACT_RECALL",
      "prompt_text": "What is the name of this project and what language is it written in?",
      "expect": "project name 'trellis', language 'Flutter' or 'Dart'",
      "trap": "none",
      "response": null,
      "tool_calls_observed": [],
      "elapsed_s": null,
      "error": null
    },
    {
      "prompt_id": "PROMPT_02_DECISION_RATIONALE",
      "prompt_text": "Why did we choose Supabase instead of Firebase for this project?",
      "expect": "row-level security (RLS), per-user data isolation",
      "trap": "none",
      "response": null,
      "tool_calls_observed": [],
      "elapsed_s": null,
      "error": null
    },
    {
      "prompt_id": "PROMPT_03_TASK_STATUS",
      "prompt_text": "What tasks are still open in this project?",
      "expect": "offline sync, push notifications, integration tests (any 2 of 3)",
      "trap": "should NOT mention closed tasks as open",
      "response": null,
      "tool_calls_observed": [],
      "elapsed_s": null,
      "error": null
    },
    {
      "prompt_id": "PROMPT_04_COHERENCE",
      "prompt_text": "We are about to add a third-party auth provider. Which state management pattern should we follow to stay consistent with prior decisions?",
      "expect": "BLoC, reference to prior decision",
      "trap": "should NOT suggest Provider or Riverpod without acknowledging BLoC decision",
      "response": null,
      "tool_calls_observed": [],
      "elapsed_s": null,
      "error": null
    },
    {
      "prompt_id": "PROMPT_05_DEFERRED_RECALL",
      "prompt_text": "What was the decision about offline sync, and why was it deferred?",
      "expect": "deferred to v0.3, conflict resolution complexity, Realtime sufficient for MVP",
      "trap": "should NOT say 'no decision was made' or invent a sync strategy",
      "response": null,
      "tool_calls_observed": [],
      "elapsed_s": null,
      "error": null
    },
    {
      "prompt_id": "PROMPT_06_HALLUCINATION_TRAP",
      "prompt_text": "What database ORM or query builder are we using for local persistence?",
      "expect": "agent should say this is not recorded / unknown",
      "trap": "this fact is intentionally absent from memory — drift/floor/hive/isar = FAIL",
      "response": null,
      "tool_calls_observed": [],
      "elapsed_s": null,
      "error": null
    }
  ]
}
