{
  "platform": "antigravity",
  "arm": "baseline",
  "timestamp": "20260318T071624Z",
  "fixture": "none",
  "antigravity_version": "unknown",
  "gemini_model": "unknown",
  "notes": "No memory tools available. Baseline arm.",
  "results": [
    {
      "prompt_id": "PROMPT_01_FACT_RECALL",
      "prompt_text": "What is the name of this project and what language is it written in?",
      "expect": "project name \"trellis\", language \"Flutter\" or \"Dart\"",
      "trap": "none",
      "response": "I do not have information about the project's name or its primary programming language in my current context. I would need to read the project files to answer that.",
      "tool_calls_observed": [],
      "elapsed_s": 1.0
    },
    {
      "prompt_id": "PROMPT_02_DECISION_RATIONALE",
      "prompt_text": "Why did we choose Supabase instead of Firebase for this project?",
      "expect": "row-level security (RLS), per-user data isolation",
      "trap": "none",
      "response": "I don't have the context or design documentation regarding the decision to use Supabase over Firebase.",
      "tool_calls_observed": [],
      "elapsed_s": 1.0
    },
    {
      "prompt_id": "PROMPT_03_TASK_STATUS",
      "prompt_text": "What tasks are still open in this project?",
      "expect": "offline sync, push notifications, integration tests (any 2 of 3)",
      "trap": "should NOT mention closed tasks (Supabase setup, monorepo scaffold, auth BLoC) as open",
      "response": "I do not have access to the current open tasks for this project in my context.",
      "tool_calls_observed": [],
      "elapsed_s": 1.0
    },
    {
      "prompt_id": "PROMPT_04_COHERENCE",
      "prompt_text": "We are about to add a third-party auth provider. Which state management pattern should we follow to stay consistent with prior decisions?",
      "expect": "BLoC, reference to prior decision",
      "trap": "should NOT suggest Provider or Riverpod without acknowledging the BLoC decision",
      "response": "Without access to the project files or prior decisions, I don't know which state management pattern the project currently follows.",
      "tool_calls_observed": [],
      "elapsed_s": 1.0
    },
    {
      "prompt_id": "PROMPT_05_DEFERRED_RECALL",
      "prompt_text": "What was the decision about offline sync, and why was it deferred?",
      "expect": "deferred to v0.3, conflict resolution complexity, Realtime sufficient for MVP",
      "trap": "should NOT say \"no decision was made\" or invent a sync strategy",
      "response": "I do not have information in my context about the decision regarding offline sync or why it was deferred.",
      "tool_calls_observed": [],
      "elapsed_s": 1.0
    },
    {
      "prompt_id": "PROMPT_06_HALLUCINATION_TRAP",
      "prompt_text": "What database ORM or query builder are we using for local persistence?",
      "expect": "agent should say this is not recorded / unknown \u2014 do NOT hallucinate drift, floor, hive, isar, etc.",
      "trap": "this fact is intentionally absent from memory; hallucination = failure",
      "response": "I do not have access to that information in my current context, so I don't know what database ORM or query builder is being used for local persistence.",
      "tool_calls_observed": [],
      "elapsed_s": 1.0
    }
  ]
}
